{
  "algorithm_version": "trial-v1",
  "complete": true,
  "demo": false,
  "entries": [
    {
      "candidate_key": "1103643573:skills/.curated/cli-creator/SKILL.md",
      "components": {
        "recent_path_commit_percentile": 0.5,
        "total_fork_percentile": 0.5,
        "total_star_percentile": 0.5
      },
      "description": "Build a composable CLI for Codex from API docs, an OpenAPI spec, existing curl examples, an SDK, a web app, an admin tool, or a local script. Use when the user wants Codex to create a command-line tool that can run from any repo, expose composable read/write commands, return stable JSON, manage auth, and pair with a companion skill.",
      "metrics": {
        "path_commits": 0,
        "repository_forks": 1652,
        "repository_stars": 24315,
        "total_forks": 1652,
        "total_stars": 24315
      },
      "name": "cli-creator",
      "path": "skills/.curated/cli-creator/SKILL.md",
      "rank": 1,
      "repository": "openai/skills",
      "repository_url": "https://github.com/openai/skills",
      "score": 50.0,
      "source_url": "https://github.com/openai/skills/blob/main/skills/.curated/cli-creator/SKILL.md"
    },
    {
      "candidate_key": "1103643573:skills/.curated/figma-create-design-system-rules/SKILL.md",
      "components": {
        "recent_path_commit_percentile": 0.5,
        "total_fork_percentile": 0.5,
        "total_star_percentile": 0.5
      },
      "description": "Generates custom design system rules for the user's codebase. Use when user says \"create design system rules\", \"generate rules for my project\", \"set up design rules\", \"customize design system guidelines\", or wants to establish project-specific conventions for Figma-to-code workflows. Requires Figma MCP server connection.",
      "metrics": {
        "path_commits": 0,
        "repository_forks": 1652,
        "repository_stars": 24315,
        "total_forks": 1652,
        "total_stars": 24315
      },
      "name": "figma-create-design-system-rules",
      "path": "skills/.curated/figma-create-design-system-rules/SKILL.md",
      "rank": 2,
      "repository": "openai/skills",
      "repository_url": "https://github.com/openai/skills",
      "score": 50.0,
      "source_url": "https://github.com/openai/skills/blob/main/skills/.curated/figma-create-design-system-rules/SKILL.md"
    }
  ],
  "generated_at": "2026-07-29T20:29:13.701734Z",
  "limitations": [
    "Stars and forks are repository aggregate snapshots, not Skill installs.",
    "Path commit counts measure default-branch history touching the Skill path, not effort.",
    "GitHub does not provide this project with exact public stargazer event times.",
    "This trial ranking uses current cumulative repository totals because a full week is unavailable."
  ],
  "ranking_status": "trial",
  "schema_version": "1.0",
  "source_observed_at": [
    "2026-07-29T20:29:13.321329Z"
  ],
  "stale_from_week": null,
  "week": {
    "end_date": "2026-08-02",
    "start_date": "2026-07-27",
    "timezone": "Asia/Shanghai"
  }
}
